{
  "schema_version": "local-baseline-v1",
  "run_id": "local-24f969341168492899e3d64c4c58c42f",
  "verification": "local-compose",
  "scenario": "baseline-smoke",
  "source_revision": "487679ffcd7125f1f1fd7878d5d84401bc7d6819",
  "started_at": "2026-10-04T00:25:36.755443+00:00",
  "finished_at": "2026-10-04T00:25:38.648845+00:00",
  "result": "passed",
  "requested_jobs": 10,
  "completed_jobs": 10,
  "completion_seconds": [
    0.049923,
    0.144799,
    0.136358,
    0.129319,
    0.121658,
    0.114463,
    0.10791,
    0.101091,
    0.195654,
    0.189458
  ],
  "fixture_sha256": "2522de9d1c28cf3a163c3703dbabb2b63009e5daa6a8d98f2aac85f577307bd5",
  "golden_reports_match": true,
  "telemetry": {
    "api_metrics": true,
    "worker_metrics": true,
    "prometheus_targets": true
  },
  "errors": [],
  "cloud_provisioned": false,
  "teardown": "not_checked"
}
