{
  "schema_version": "local-baseline-v1",
  "run_id": "local-a95e34405f0f41359aaf87ed5dcd7bfc",
  "verification": "local-compose",
  "scenario": "baseline-smoke",
  "source_revision": "ce56202cfc03ce50382e4ea8d51c6de5b5b61032",
  "started_at": "2026-10-03T22:30:38.941566+00:00",
  "finished_at": "2026-10-03T22:30:40.830247+00:00",
  "result": "passed",
  "requested_jobs": 10,
  "completed_jobs": 10,
  "completion_seconds": [
    0.01339,
    0.108069,
    0.100818,
    0.195484,
    0.189959,
    0.18306,
    0.176217,
    0.169483,
    0.163495,
    0.156611
  ],
  "fixture_sha256": "2522de9d1c28cf3a163c3703dbabb2b63009e5daa6a8d98f2aac85f577307bd5",
  "golden_reports_match": true,
  "telemetry": {
    "api_metrics": true,
    "worker_metrics": true,
    "prometheus_targets": true
  },
  "errors": [],
  "cloud_provisioned": false,
  "teardown": "not_checked"
}
